ffff8a9b1422ac00 2454036614 C Ii:5:002:1 0:4 61 = 01000000 00000000 00000000 00000000 00000000 00000000 00000000 00000000
ffff8a9b1422ac00 2454036673 S Ii:5:002:1 -115:4 61 <
ffff8a9b1422ac00 2454040584 C Ii:5:002:1 0:4 32 = 5d0a0000 00000000 00000000 00000000 00000000 00000000 00000000 00000000
ffff8a9b1422ac00 2454040590 S Ii:5:002:1 -115:4 61 <
ffff8a9b1422ac00 2455524597 C Ii:5:002:1 0:4 61 = 01040000 00000000 00000000 00000000 00000000 00000000 00000000 00000000
ffff8a9b1422ac00 2455524641 S Ii:5:002:1 -115:4 61 <
ffff8a9b1422ac00 2455528576 C Ii:5:002:1 0:4 32 = 5d0a0000 00000000 00000000 00000000 00000200 00000000 00000000 00000000
ffff8a9b1422ac00 2455528585 S Ii:5:002:1 -115:4 61 <
ffff8a9b1422ac00 2455684616 C Ii:5:002:1 0:4 61 = 0104002b 00000000 00000000 00000000 00000000 00000000 00000000 00000000
ffff8a9b1422ac00 2455684649 S Ii:5:002:1 -115:4 61 <
ffff8a9b1422ac00 2455688628 C Ii:5:002:1 0:4 32 = 5d0a0000 00000000 00800000 00000000 00000200 00000000 00000000 00000000
ffff8a9b1422ac00 2455688636 S Ii:5:002:1 -115:4 61 <
ffff8a9b1422ac00 2455840587 C Ii:5:002:1 0:4 61 = 01040000 00000000 00000000 00000000 00000000 00000000 00000000 00000000
ffff8a9b1422ac00 2455840629 S Ii:5:002:1 -115:4 61 <
ffff8a9b1422ac00 2455844591 C Ii:5:002:1 0:4 32 = 5d0a0000 00000000 00000000 00000000 00000200 00000000 00000000 00000000
ffff8a9b1422ac00 2455844601 S Ii:5:002:1 -115:4 61 <
ffff8a9b1422ac00 2456604621 C Ii:5:002:1 0:4 61 = 01000000 00000000 00000000 00000000 00000000 00000000 00000000 00000000
ffff8a9b1422ac00 2456604683 S Ii:5:002:1 -115:4 61 <
ffff8a9b1422ac00 2456608496 C Ii:5:002:1 0:4 32 = 5d0a0000 00000000 00000000 00000000 00000000 00000000 00000000 00000000
ffff8a9b1422ac00 2456608499 S Ii:5:002:1 -115:4 61 <
ffff8a9b043c5d40 2460670656 S Co:5:002:0 s 21 09 025d 0000 0040 64 = 5db30001 000000eb 00000000 00000000 00000000 00000000 00000000 00000000
ffff8a9b043c5d40 2460671842 C Co:5:002:0 0 64 >
ffff8a9b043c5d40 2460671984 S Co:5:002:0 s 21 09 025d 0000 0040 64 = 5db50000 00000000 00000000 00000000 00000000 00000000 00000000 00000000
ffff8a9b1422ac00 2460672572 C Ii:5:002:1 0:4 6 = 5decb300 0000
ffff8a9b1422ac00 2460672579 S Ii:5:002:1 -115:4 61 <
ffff8a9b043c5d40 2460673115 C Co:5:002:0 0 64 >
ffff8a9b043c5d40 2460673242 S Co:5:002:0 s 21 09 025d 0000 0040 64 = 5db40000 00000000 00000000 00000000 00000000 00000000 00000000 00000000
ffff8a9b043c5d40 2460674486 C Co:5:002:0 0 64 >
ffff8a9b043c3140 2460674683 S Co:5:002:0 s 21 09 035a 0000 0005 5 = 5abac5c4 03
ffff8a9b043c3140 2460675486 C Co:5:002:0 0 5 >
ffff8a9b1422ac00 2460676491 C Ii:5:002:1 0:4 6 = 5decb500 0000
ffff8a9b1422ac00 2460676493 S Ii:5:002:1 -115:4 61 <
ffff8a9b1422ac00 2460680490 C Ii:5:002:1 0:4 6 = 5decb400 0000
ffff8a9b1422ac00 2460680492 S Ii:5:002:1 -115:4 61 <
ffff8a9b043c5d40 2463263288 S Co:5:002:0 s 21 09 025d 0000 0040 64 = 5db30000 000000eb 00000000 00000000 00000000 00000000 00000000 00000000
ffff8a9b043c5d40 2463264241 C Co:5:002:0 0 64 >
ffff8a9b043c5d40 2463264414 S Co:5:002:0 s 21 09 025d 0000 0040 64 = 5db50000 00000000 00000000 00000000 00000000 00000000 00000000 00000000
ffff8a9b1422ac00 2463264557 C Ii:5:002:1 0:4 6 = 5decb300 0000
ffff8a9b1422ac00 2463264561 S Ii:5:002:1 -115:4 61 <
ffff8a9b043c5d40 2463265700 C Co:5:002:0 0 64 >
ffff8a9b043c5d40 2463265814 S Co:5:002:0 s 21 09 025d 0000 0040 64 = 5db40000 00000000 00000000 00000000 00000000 00000000 00000000 00000000
ffff8a9b043c5d40 2463267227 C Co:5:002:0 0 64 >
ffff8a9b0442be00 2463267426 S Co:5:002:0 s 21 09 035a 0000 0005 5 = 5abac5c4 03
ffff8a9b0442be00 2463268257 C Co:5:002:0 0 5 >
ffff8a9b1422ac00 2463268497 C Ii:5:002:1 0:4 6 = 5decb500 0000
ffff8a9b1422ac00 2463268499 S Ii:5:002:1 -115:4 61 <
ffff8a9b1422ac00 2463272496 C Ii:5:002:1 0:4 6 = 5decb400 0000
ffff8a9b1422ac00 2463272498 S Ii:5:002:1 -115:4 61 <
ffff8a9b0442d080 2466791561 S Co:5:002:0 s 21 09 025d 0000 0040 64 = 5db30000 000000eb 00000000 00000000 00000000 00000000 00000000 00000000
ffff8a9b0442d080 2466792296 C Co:5:002:0 0 64 >
ffff8a9b0442d080 2466792362 S Co:5:002:0 s 21 09 025d 0000 0040 64 = 5db50000 00000000 00000000 00000000 00000000 00000000 00000000 00000000
ffff8a9b0442d080 2466793348 C Co:5:002:0 0 64 >
ffff8a9b0442d080 2466793441 S Co:5:002:0 s 21 09 025d 0000 0040 64 = 5db40000 00000000 00000000 00000000 00000000 00000000 00000000 00000000
ffff8a9b0442d080 2466795004 C Co:5:002:0 0 64 >
ffff8a9b043c3140 2466795239 S Co:5:002:0 s 21 09 035a 0000 0005 5 = 5abac5c4 03
ffff8a9b043c3140 2466795914 C Co:5:002:0 0 5 >
ffff8a9b1422ac00 2466796506 C Ii:5:002:1 0:4 6 = 5decb300 0000
ffff8a9b1422ac00 2466796510 S Ii:5:002:1 -115:4 61 <
ffff8a9b1422ac00 2466800504 C Ii:5:002:1 0:4 6 = 5decb500 0000
ffff8a9b1422ac00 2466800506 S Ii:5:002:1 -115:4 61 <
ffff8a9b1422ac00 2466804505 C Ii:5:002:1 0:4 6 = 5decb400 0000
ffff8a9b1422ac00 2466804507 S Ii:5:002:1 -115:4 61 <
ffff8a9b0442d080 2468654615 S Co:5:002:0 s 21 09 025d 0000 0040 64 = 5db30000 000000eb 00000000 00000000 00000000 00000000 00000000 00000000
ffff8a9b0442d080 2468655753 C Co:5:002:0 0 64 >
ffff8a9b0442d080 2468655890 S Co:5:002:0 s 21 09 025d 0000 0040 64 = 5db50000 00000000 00000000 00000000 00000000 00000000 00000000 00000000
ffff8a9b1422ac00 2468656592 C Ii:5:002:1 0:4 6 = 5decb300 0000
ffff8a9b1422ac00 2468656602 S Ii:5:002:1 -115:4 61 <
ffff8a9b0442d080 2468657092 C Co:5:002:0 0 64 >
ffff8a9b0442d080 2468657281 S Co:5:002:0 s 21 09 025d 0000 0040 64 = 5db40000 00000000 00000000 00000000 00000000 00000000 00000000 00000000
ffff8a9b0442d080 2468658445 C Co:5:002:0 0 64 >
ffff8a9b02b0f680 2468658725 S Co:5:002:0 s 21 09 035a 0000 0005 5 = 5abac5c4 03
ffff8a9b02b0f680 2468659450 C Co:5:002:0 0 5 >
ffff8a9b1422ac00 2468660509 C Ii:5:002:1 0:4 6 = 5decb500 0000
ffff8a9b1422ac00 2468660511 S Ii:5:002:1 -115:4 61 <
ffff8a9b1422ac00 2468664509 C Ii:5:002:1 0:4 6 = 5decb400 0000
ffff8a9b1422ac00 2468664510 S Ii:5:002:1 -115:4 61 <
ffff8a9b04218900 2471136495 S Co:5:002:0 s 21 09 025d 0000 0040 64 = 5db30000 000000eb 00000000 00000000 00000000 00000000 00000000 00000000
ffff8a9b04218900 2471137645 C Co:5:002:0 0 64 >
ffff8a9b04218900 2471137816 S Co:5:002:0 s 21 09 025d 0000 0040 64 = 5db50000 00000000 00000000 00000000 00000000 00000000 00000000 00000000
ffff8a9b04218900 2471138697 C Co:5:002:0 0 64 >
ffff8a9b04218900 2471138850 S Co:5:002:0 s 21 09 025d 0000 0040 64 = 5db40000 00000000 00000000 00000000 00000000 00000000 00000000 00000000
ffff8a9b04218900 2471140064 C Co:5:002:0 0 64 >
ffff8a9b043c2b40 2471140438 S Co:5:002:0 s 21 09 035a 0000 0005 5 = 5abac5c4 03
ffff8a9b1422ac00 2471140516 C Ii:5:002:1 0:4 6 = 5decb300 0000
ffff8a9b1422ac00 2471140521 S Ii:5:002:1 -115:4 61 <
ffff8a9b043c2b40 2471141135 C Co:5:002:0 0 5 >
ffff8a9b1422ac00 2471144515 C Ii:5:002:1 0:4 6 = 5decb500 0000
ffff8a9b1422ac00 2471144516 S Ii:5:002:1 -115:4 61 <
ffff8a9b1422ac00 2471148515 C Ii:5:002:1 0:4 6 = 5decb400 0000
ffff8a9b1422ac00 2471148517 S Ii:5:002:1 -115:4 61 <
ffff8a9b0442d080 2473889205 S Co:5:002:0 s 21 09 025d 0000 0040 64 = 5db3000a 000000eb 00000000 00000000 00000000 00000000 00000000 00000000
ffff8a9b0442d080 2473890156 C Co:5:002:0 0 64 >
ffff8a9b0442d080 2473890172 S Co:5:002:0 s 21 09 025d 0000 0040 64 = 5db50000 00000000 00000000 00000000 00000000 00000000 00000000 00000000
ffff8a9b0442d080 2473891120 C Co:5:002:0 0 64 >
ffff8a9b0442d080 2473891126 S Co:5:002:0 s 21 09 025d 0000 0040 64 = 5db40000 00000000 00000000 00000000 00000000 00000000 00000000 00000000
ffff8a9b0442d080 2473892430 C Co:5:002:0 0 64 >
ffff8a9b1422ac00 2473892519 C Ii:5:002:1 0:4 6 = 5decb300 0000
ffff8a9b1422ac00 2473892522 S Ii:5:002:1 -115:4 61 <
ffff8a9b02b0f680 2473892543 S Co:5:002:0 s 21 09 035a 0000 0005 5 = 5abac5c4 03
ffff8a9b02b0f680 2473893440 C Co:5:002:0 0 5 >
ffff8a9b1422ac00 2473896522 C Ii:5:002:1 0:4 6 = 5decb500 0000
ffff8a9b1422ac00 2473896524 S Ii:5:002:1 -115:4 61 <
ffff8a9b1422ac00 2473900521 C Ii:5:002:1 0:4 6 = 5decb400 0000
ffff8a9b1422ac00 2473900523 S Ii:5:002:1 -115:4 61 <
ffff8a9b31a3e600 2476846655 S Co:5:002:0 s 21 09 025d 0000 0040 64 = 5db30002 000000eb 00000000 00000000 00000000 00000000 00000000 00000000
ffff8a9b31a3e600 2476847667 C Co:5:002:0 0 64 >
ffff8a9b31a3e600 2476847795 S Co:5:002:0 s 21 09 025d 0000 0040 64 = 5db50000 00000000 00000000 00000000 00000000 00000000 00000000 00000000
ffff8a9b1422ac00 2476848624 C Ii:5:002:1 0:4 6 = 5decb300 0000
ffff8a9b1422ac00 2476848629 S Ii:5:002:1 -115:4 61 <
ffff8a9b31a3e600 2476848666 C Co:5:002:0 0 64 >
ffff8a9b31a3e600 2476848796 S Co:5:002:0 s 21 09 025d 0000 0040 64 = 5db40000 00000000 00000000 00000000 00000000 00000000 00000000 00000000
ffff8a9b31a3e600 2476850072 C Co:5:002:0 0 64 >
ffff8a9b043c3140 2476850232 S Co:5:002:0 s 21 09 035a 0000 0005 5 = 5abac5c4 03
ffff8a9b043c3140 2476851005 C Co:5:002:0 0 5 >
ffff8a9b1422ac00 2476852528 C Ii:5:002:1 0:4 6 = 5decb500 0000
ffff8a9b1422ac00 2476852530 S Ii:5:002:1 -115:4 61 <
ffff8a9b1422ac00 2476856528 C Ii:5:002:1 0:4 6 = 5decb400 0000
ffff8a9b1422ac00 2476856529 S Ii:5:002:1 -115:4 61 <
ffff8a9b31a3e600 2483084630 S Co:5:002:0 s 21 09 025d 0000 0040 64 = 5db30001 000000eb 00000000 00000000 00000000 00000000 00000000 00000000
ffff8a9b31a3e600 2483085709 C Co:5:002:0 0 64 >
ffff8a9b31a3e600 2483085798 S Co:5:002:0 s 21 09 025d 0000 0040 64 = 5db50000 00000000 00000000 00000000 00000000 00000000 00000000 00000000
ffff8a9b31a3e600 2483086761 C Co:5:002:0 0 64 >
ffff8a9b31a3e600 2483086836 S Co:5:002:0 s 21 09 025d 0000 0040 64 = 5db40000 00000000 00000000 00000000 00000000 00000000 00000000 00000000
ffff8a9b31a3e600 2483088117 C Co:5:002:0 0 64 >
ffff8a9b04219b00 2483088266 S Co:5:002:0 s 21 09 035a 0000 0005 5 = 5abac5c4 03
ffff8a9b1422ac00 2483088540 C Ii:5:002:1 0:4 6 = 5decb300 0000
ffff8a9b1422ac00 2483088544 S Ii:5:002:1 -115:4 61 <
ffff8a9b04219b00 2483089228 C Co:5:002:0 0 5 >
ffff8a9b1422ac00 2483092544 C Ii:5:002:1 0:4 6 = 5decb500 0000
ffff8a9b1422ac00 2483092547 S Ii:5:002:1 -115:4 61 <
ffff8a9b1422ac00 2483100547 C Ii:5:002:1 0:4 6 = 5decb400 0000
ffff8a9b1422ac00 2483100551 S Ii:5:002:1 -115:4 61 <
ffff8a9b31a3e600 2487526564 S Co:5:002:0 s 21 09 025d 0000 0040 64 = 5db30003 000000eb 00000000 00000000 00000000 00000000 00000000 00000000
ffff8a9b31a3e600 2487527462 C Co:5:002:0 0 64 >
ffff8a9b31a3e600 2487527606 S Co:5:002:0 s 21 09 025d 0000 0040 64 = 5db50000 00000000 00000000 00000000 00000000 00000000 00000000 00000000
ffff8a9b1422ac00 2487528656 C Ii:5:002:1 0:4 6 = 5decb300 0000
ffff8a9b1422ac00 2487528662 S Ii:5:002:1 -115:4 61 <
ffff8a9b31a3e600 2487528795 C Co:5:002:0 0 64 >
ffff8a9b31a3e600 2487528880 S Co:5:002:0 s 21 09 025d 0000 0040 64 = 5db40000 00000000 00000000 00000000 00000000 00000000 00000000 00000000
ffff8a9b31a3e600 2487530122 C Co:5:002:0 0 64 >
ffff8a9b043c2b40 2487530454 S Co:5:002:0 s 21 09 035a 0000 0005 5 = 5abac5c4 03
ffff8a9b1422ac00 2487532552 C Ii:5:002:1 0:4 6 = 5decb500 0000
ffff8a9b1422ac00 2487532554 S Ii:5:002:1 -115:4 61 <
ffff8a9b043c2b40 2487549329 C Co:5:002:0 0 5 >
ffff8a9b1422ac00 2487552555 C Ii:5:002:1 0:4 6 = 5decb400 0000
ffff8a9b1422ac00 2487552557 S Ii:5:002:1 -115:4 61 <
ffff8a9b1422ac00 2489104692 C Ii:5:002:1 0:4 61 = 01040000 00000000 00000000 00000000 00000000 00000000 00000000 00000000
ffff8a9b1422ac00 2489104747 S Ii:5:002:1 -115:4 61 <
ffff8a9b1422ac00 2489108570 C Ii:5:002:1 0:4 32 = 5d0a0000 00000000 00000000 00000000 00000200 00000000 00000000 00000000
ffff8a9b1422ac00 2489108571 S Ii:5:002:1 -115:4 61 <
ffff8a9b1422ac00 2489308681 C Ii:5:002:1 0:4 61 = 0104002b 00000000 00000000 00000000 00000000 00000000 00000000 00000000
ffff8a9b1422ac00 2489308718 S Ii:5:002:1 -115:4 61 <
ffff8a9b1422ac00 2489312572 C Ii:5:002:1 0:4 32 = 5d0a0000 00000000 00800000 00000000 00000200 00000000 00000000 00000000
ffff8a9b1422ac00 2489312574 S Ii:5:002:1 -115:4 61 <
ffff8a9b1422ac00 2489428680 C Ii:5:002:1 0:4 61 = 01040000 00000000 00000000 00000000 00000000 00000000 00000000 00000000
ffff8a9b1422ac00 2489428722 S Ii:5:002:1 -115:4 61 <
ffff8a9b1422ac00 2489432685 C Ii:5:002:1 0:4 32 = 5d0a0000 00000000 00000000 00000000 00000200 00000000 00000000 00000000
ffff8a9b1422ac00 2489432695 S Ii:5:002:1 -115:4 61 <
ffff8a9b1422ac00 2490172704 C Ii:5:002:1 0:4 61 = 01000000 00000000 00000000 00000000 00000000 00000000 00000000 00000000
ffff8a9b1422ac00 2490172751 S Ii:5:002:1 -115:4 61 <
ffff8a9b1422ac00 2490176659 C Ii:5:002:1 0:4 32 = 5d0a0000 00000000 00000000 00000000 00000000 00000000 00000000 00000000
ffff8a9b1422ac00 2490176668 S Ii:5:002:1 -115:4 61 <
