ffff8a9b16dfc780 1659923462 C Ii:5:002:1 0:4 61 = 01000000 00000000 00000000 00000000 00000000 00000000 00000000 00000000
ffff8a9b16dfc780 1659923515 S Ii:5:002:1 -115:4 61 <
ffff8a9b16dfc780 1659927446 C Ii:5:002:1 0:4 32 = 5d0a0000 00000000 00000000 00000000 00000000 00000000 00000000 00000000
ffff8a9b16dfc780 1659927450 S Ii:5:002:1 -115:4 61 <
ffff8a9b16dfc780 1660840905 C Ii:5:002:1 -108:4 0
ffff8a9b1422ac00 1660935809 S Co:5:002:0 s 21 0a 0000 0001 0000 0
ffff8a9b1422ac00 1660936121 C Co:5:002:0 -32 0
ffff8a9b1422ac00 1660936167 S Co:5:002:0 s 21 0a 0000 0000 0000 0
ffff8a9b1422ac00 1660936493 C Co:5:002:0 0 0
ffff8a9b1422ac00 1660936506 S Co:5:002:0 s 21 09 0201 0000 0002 2 = 0101
ffff8a9b1422ac00 1660937151 C Co:5:002:0 0 2 >
ffff8a9b1422ac00 1660937159 S Co:5:002:0 s 21 09 025d 0000 0040 64 = 5db30002 000000eb 00000000 00000000 00000000 00000000 00000000 00000000
ffff8a9b1422ac00 1660938472 C Co:5:002:0 0 64 >
ffff8a9b1422ac00 1660938481 S Co:5:002:0 s 21 09 025d 0000 0040 64 = 5db40000 00000000 00000000 00000000 00000000 00000000 00000000 00000000
ffff8a9b1422ac00 1660939597 C Co:5:002:0 0 64 >
ffff8a9b1422ac00 1660939611 S Co:5:002:0 s 21 09 025d 0000 0040 64 = 5db50000 00000000 00000000 00000000 00000000 00000000 00000000 00000000
ffff8a9b1422ac00 1660940630 C Co:5:002:0 0 64 >
ffff8a9b1422ac00 1660940643 S Co:5:002:0 s 21 09 0305 0001 000a 10 = 05000800 0f000000 0001
ffff8a9b1422ac00 1660941342 C Co:5:002:0 0 10 >
ffff8a9b1422ac00 1660941372 S Co:5:002:0 s 21 09 0304 0001 0033 51 = 04080100 00010002 00030004 00050006 000700ff 0000ff00 ff00ff00 00ffffff
ffff8a9b1422ac00 1660942214 C Co:5:002:0 0 51 >
ffff8a9b1422ac00 1661442423 S Co:5:002:0 s 21 09 0304 0001 0033 51 = 04080100 00010002 00030004 00050006 000700ff 0000ff00 ff00ff00 00ffffff
ffff8a9b1422ac00 1661443332 C Co:5:002:0 0 51 >
ffff8a9b1422ac00 1661943590 S Co:5:002:0 s 21 09 0304 0001 0033 51 = 04080100 00010002 00030004 00050006 000700ff 0000ff00 ff00ff00 00ffffff
ffff8a9b1422ac00 1661944410 C Co:5:002:0 0 51 >
ffff8a9b1422ac00 1662444749 S Co:5:002:0 s 21 09 0304 0001 0033 51 = 04080100 00010002 00030004 00050006 000700ff 0000ff00 ff00ff00 00ffffff
ffff8a9b1422ac00 1662445564 C Co:5:002:0 0 51 >
ffff8a9b1422ac00 1662945966 S Co:5:002:0 s 21 09 0304 0001 0033 51 = 04080100 00010002 00030004 00050006 000700ff 0000ff00 ff00ff00 00ffffff
ffff8a9b1422ac00 1662947394 C Co:5:002:0 0 51 >
ffff8a9b1422ac00 1663447816 S Co:5:002:0 s 21 09 0304 0001 0033 51 = 04080100 00010002 00030004 00050006 000700ff 0000ff00 ff00ff00 00ffffff
ffff8a9b1422ac00 1663448716 C Co:5:002:0 0 51 >
ffff8a9b1422ac00 1663949208 S Co:5:002:0 s 21 09 0304 0001 0033 51 = 04080100 00010002 00030004 00050006 000700ff 0000ff00 ff00ff00 00ffffff
ffff8a9b1422ac00 1663950038 C Co:5:002:0 0 51 >
ffff8a9b1422ac00 1664450545 S Co:5:002:0 s 21 09 0304 0001 0033 51 = 04080100 00010002 00030004 00050006 000700ff 0000ff00 ff00ff00 00ffffff
ffff8a9b1422ac00 1664451280 C Co:5:002:0 0 51 >
ffff8a9b1422ac00 1664951683 S Co:5:002:0 s 21 09 0304 0001 0033 51 = 04080100 00010002 00030004 00050006 000700ff 0000ff00 ff00ff00 00ffffff
ffff8a9b1422ac00 1664952491 C Co:5:002:0 0 51 >
ffff8a9b1422ac00 1665452893 S Co:5:002:0 s 21 09 0304 0001 0033 51 = 04080100 00010002 00030004 00050006 000700ff 0000ff00 ff00ff00 00ffffff
ffff8a9b1422ac00 1665454136 C Co:5:002:0 0 51 >
ffff8a9b1422ac00 1665954562 S Co:5:002:0 s 21 09 0304 0001 0033 51 = 04080100 00010002 00030004 00050006 000700ff 0000ff00 ff00ff00 00ffffff
ffff8a9b1422ac00 1665955410 C Co:5:002:0 0 51 >
ffff8a9b1422ac00 1666455680 S Co:5:002:0 s 21 09 0304 0001 0033 51 = 04080100 00010002 00030004 00050006 000700ff 0000ff00 ff00ff00 00ffffff
ffff8a9b1422ac00 1666456392 C Co:5:002:0 0 51 >
ffff8a9b1422ac00 1666956806 S Co:5:002:0 s 21 09 0304 0001 0033 51 = 04080100 00010002 00030004 00050006 000700ff 0000ff00 ff00ff00 00ffffff
ffff8a9b1422ac00 1666958058 C Co:5:002:0 0 51 >
ffff8a9b1422ac00 1667458462 S Co:5:002:0 s 21 09 0304 0001 0033 51 = 04080100 00010002 00030004 00050006 000700ff 0000ff00 ff00ff00 00ffffff
ffff8a9b1422ac00 1667459445 C Co:5:002:0 0 51 >
ffff8a9b1422ac00 1667959723 S Co:5:002:0 s 21 09 0304 0001 0033 51 = 04080100 00010002 00030004 00050006 000700ff 0000ff00 ff00ff00 00ffffff
ffff8a9b1422ac00 1667960398 C Co:5:002:0 0 51 >
ffff8a9b1422ac00 1668460735 S Co:5:002:0 s 21 09 0304 0001 0033 51 = 04080100 00010002 00030004 00050006 000700ff 0000ff00 ff00ff00 00ffffff
ffff8a9b1422ac00 1668461473 C Co:5:002:0 0 51 >
ffff8a9b1422ac00 1668961912 S Co:5:002:0 s 21 09 0304 0001 0033 51 = 04080100 00010002 00030004 00050006 000700ff 0000ff00 ff00ff00 00ffffff
ffff8a9b1422ac00 1668963178 C Co:5:002:0 0 51 >
ffff8a9b1422ac00 1669463559 S Co:5:002:0 s 21 09 0304 0001 0033 51 = 04080100 00010002 00030004 00050006 000700ff 0000ff00 ff00ff00 00ffffff
ffff8a9b1422ac00 1669464458 C Co:5:002:0 0 51 >
ffff8a9b1422ac00 1669964855 S Co:5:002:0 s 21 09 0304 0001 0033 51 = 04080100 00010002 00030004 00050006 000700ff 0000ff00 ff00ff00 00ffffff
ffff8a9b1422ac00 1669965628 C Co:5:002:0 0 51 >
ffff8a9b1422ac00 1670466072 S Co:5:002:0 s 21 09 0304 0001 0033 51 = 04080100 00010002 00030004 00050006 000700ff 0000ff00 ff00ff00 00ffffff
ffff8a9b1422ac00 1670466939 C Co:5:002:0 0 51 >
ffff8a9b1422ac00 1670967480 S Co:5:002:0 s 21 0a 0000 0000 0000 0
ffff8a9b1422ac00 1670967842 C Co:5:002:0 0 0
ffff8a9b1422ac00 1670967854 S Ci:5:002:0 s 81 06 2200 0000 01a3 419 <
ffff8a9b1422ac00 1670970559 C Ci:5:002:0 0 419 = 0689ff09 10a10185 a5090115 0026ff00 75089510 b100c005 010906a1 01850175
ffff8a9b1e2af740 1670971429 S Co:5:002:0 s 21 09 0201 0000 0002 2 = 0100
ffff8a9b1e2ae540 1670971694 S Co:5:002:0 s 21 09 035a 0000 0004 4 = 5ad04e01
ffff8a9b1e2af740 1670971888 C Co:5:002:0 0 2 >
ffff8a9b1e2ae540 1670972457 C Co:5:002:0 0 4 >
ffff8a9b1422ac00 1670972646 S Ii:5:002:1 -115:4 61 <
ffff8a9b1422ac00 1670975436 C Ii:5:002:1 0:4 6 = 5decb300 0000
ffff8a9b1422ac00 1670975440 S Ii:5:002:1 -115:4 61 <
ffff8a9b1422ac00 1670979401 C Ii:5:002:1 0:4 6 = 5decb400 0000
ffff8a9b1422ac00 1670979404 S Ii:5:002:1 -115:4 61 <
ffff8a9b1422ac00 1670983406 C Ii:5:002:1 0:4 6 = 5decb500 0000
ffff8a9b1422ac00 1670983408 S Ii:5:002:1 -115:4 61 <
ffff8a9b1e2ae540 1671051378 S Co:5:002:0 s 21 09 035a 0000 0010 16 = 5a415355 53205465 63682e49 6e632e00
ffff8a9b1e2ae540 1671052124 C Co:5:002:0 0 16 >
ffff8a9b1e2ae540 1671052132 S Ci:5:002:0 s a1 01 035a 0000 0040 64 <
ffff8a9b1e2ae540 1671053113 C Ci:5:002:0 0 63 = 5a415355 53205465 63682e49 6e632e00 08951081 02098e15 0026ff00 75089510
ffff8a9b1e2ae540 1671053120 S Co:5:002:0 s 21 09 035a 0000 0006 6 = 5a052031 0008
ffff8a9b1e2ae540 1671053909 C Co:5:002:0 0 6 >
ffff8a9b1e2ae540 1671053916 S Ci:5:002:0 s a1 01 035a 0000 0040 64 <
ffff8a9b1e2ae540 1671054770 C Ci:5:002:0 0 63 = 5a052031 00080301 01022505 01020000 00000000 00000000 00000000 00089510
ffff8a9b1e2ae540 1671054774 S Co:5:002:0 s 21 09 035d 0000 0010 16 = 5d415355 53205465 63682e49 6e632e00
ffff8a9b1422ac00 1671055307 C Ii:5:002:1 0:4 6 = 5aec0200 0000
ffff8a9b1422ac00 1671055309 S Ii:5:002:1 -115:4 61 <
ffff8a9b1e2ae540 1671055630 C Co:5:002:0 0 16 >
ffff8a9b1e2ae540 1671055637 S Ci:5:002:0 s a1 01 035d 0000 0040 64 <
ffff8a9b1e2ae540 1671056430 C Ci:5:002:0 0 63 = 5d415355 53205465 63682e49 6e632e00 00000000 00000000 00000000 00089510
ffff8a9b1e2ae540 1671056434 S Co:5:002:0 s 21 09 035e 0000 0010 16 = 5e415355 53205465 63682e49 6e632e00
ffff8a9b1e2ae540 1671057090 C Co:5:002:0 0 16 >
ffff8a9b1e2ae540 1671057094 S Ci:5:002:0 s a1 01 035e 0000 0040 64 <
ffff8a9b1e2ae540 1671057921 C Ci:5:002:0 0 16 = 5effffff ffffffff ffffffff ffffffff
ffff8a9b04218900 1671058030 S Co:5:002:0 s 21 09 035a 0000 0005 5 = 5abac5c4 03
ffff8a9b1e2ae540 1671058040 S Co:5:002:0 s 21 0a 0000 0001 0000 0
ffff8a9b1e2ae540 1671058574 C Co:5:002:0 -32 0
ffff8a9b1e2ae540 1671058578 S Ci:5:002:0 s 81 06 2200 0001 0147 327 <
ffff8a9b04218900 1671059415 C Co:5:002:0 0 5 >
ffff8a9b1e2ae540 1671061759 C Ci:5:002:0 0 327 = 05590901 a1018501 0902a102 09031500 27ffff00 00751095 01b10309 04090509
