ffff8a9b3b2a3200 3834313287 C Ii:5:002:1 0:4 61 = 01000000 00000000 00000000 00000000 00000000 00000000 00000000 00000000
ffff8a9b3b2a3200 3834313346 S Ii:5:002:1 -115:4 61 <
ffff8a9b3b2a3200 3834317309 C Ii:5:002:1 0:4 32 = 5d0a0000 00000000 00000000 00000000 00000000 00000000 00000000 00000000
ffff8a9b3b2a3200 3834317315 S Ii:5:002:1 -115:4 61 <
ffff8a9b3b2a3200 3835259483 C Ii:5:002:1 -108:4 0
ffff8a9b1e2ab800 3835349683 S Co:5:002:0 s 21 0a 0000 0001 0000 0
ffff8a9b1e2ab800 3835350213 C Co:5:002:0 -32 0
ffff8a9b1e2ab800 3835350252 S Co:5:002:0 s 21 0a 0000 0000 0000 0
ffff8a9b1e2ab800 3835350834 C Co:5:002:0 0 0
ffff8a9b1e2ab800 3835350842 S Co:5:002:0 s 21 09 0201 0000 0002 2 = 0101
ffff8a9b1e2ab800 3835351541 C Co:5:002:0 0 2 >
ffff8a9b1e2ab800 3835351559 S Co:5:002:0 s 21 09 025d 0000 0040 64 = 5db30002 000000eb 00000000 00000000 00000000 00000000 00000000 00000000
ffff8a9b1e2ab800 3835352747 C Co:5:002:0 0 64 >
ffff8a9b1e2ab800 3835352763 S Co:5:002:0 s 21 09 025d 0000 0040 64 = 5db40000 00000000 00000000 00000000 00000000 00000000 00000000 00000000
ffff8a9b1e2ab800 3835354026 C Co:5:002:0 0 64 >
ffff8a9b1e2ab800 3835354453 S Co:5:002:0 s 21 09 025d 0000 0040 64 = 5db50000 00000000 00000000 00000000 00000000 00000000 00000000 00000000
ffff8a9b1e2ab800 3835355187 C Co:5:002:0 0 64 >
ffff8a9b1e2ab800 3835355385 S Co:5:002:0 s 21 09 0305 0001 000a 10 = 05000800 0f000000 0001
ffff8a9b1e2ab800 3835356066 C Co:5:002:0 0 10 >
ffff8a9b1e2ab800 3835356194 S Co:5:002:0 s 21 09 0304 0001 0033 51 = 04010100 00000000 00000000 00000000 000000ff 0000ff00 00000000 00000000
ffff8a9b1e2ab800 3835356982 C Co:5:002:0 0 51 >
ffff8a9b1e2ab800 3835457338 S Co:5:002:0 s 21 09 0304 0001 0033 51 = 04010101 00000000 00000000 00000000 00000000 ff00ff00 00000000 00000000
ffff8a9b1e2ab800 3835458159 C Co:5:002:0 0 51 >
ffff8a9b1e2ab800 3835558592 S Co:5:002:0 s 21 09 0304 0001 0033 51 = 04010102 00000000 00000000 00000000 00000000 00ffff00 00000000 00000000
ffff8a9b1e2ab800 3835559364 C Co:5:002:0 0 51 >
ffff8a9b1e2ab800 3835659710 S Co:5:002:0 s 21 09 0304 0001 0033 51 = 04010103 00000000 00000000 00000000 000000ff ffffff00 00000000 00000000
ffff8a9b1e2ab800 3835660498 C Co:5:002:0 0 51 >
ffff8a9b1e2ab800 3835760860 S Co:5:002:0 s 21 09 0304 0001 0033 51 = 04010105 00000000 00000000 00000000 000000ff 0000ff00 00000000 00000000
ffff8a9b1e2ab800 3835761717 C Co:5:002:0 0 51 >
ffff8a9b1e2ab800 3835862077 S Co:5:002:0 s 21 09 0304 0001 0033 51 = 04010104 00000000 00000000 00000000 00000000 ff00ff00 00000000 00000000
ffff8a9b1e2ab800 3835862877 C Co:5:002:0 0 51 >
ffff8a9b1e2ab800 3835963292 S Co:5:002:0 s 21 09 0304 0001 0033 51 = 04010107 00000000 00000000 00000000 00000000 00ffff00 00000000 00000000
ffff8a9b1e2ab800 3835964122 C Co:5:002:0 0 51 >
ffff8a9b1e2ab800 3836064513 S Co:5:002:0 s 21 09 0304 0001 0033 51 = 04010106 00000000 00000000 00000000 000000ff ff00ff00 00000000 00000000
ffff8a9b1e2ab800 3836065289 C Co:5:002:0 0 51 >
ffff8a9b1e2ab800 3836165523 S Co:5:002:0 s 21 09 0304 0001 0033 51 = 04010108 00000000 00000000 00000000 00000000 0000ff00 00000000 00000000
ffff8a9b1e2ab800 3836166275 C Co:5:002:0 0 51 >
ffff8a9b1e2ab800 3836266567 S Co:5:002:0 s 21 09 0304 0001 0033 51 = 04010109 00000000 00000000 00000000 00000000 0000ff00 00000000 00000000
ffff8a9b1e2ab800 3836267284 C Co:5:002:0 0 51 >
ffff8a9b1e2ab800 3836367536 S Co:5:002:0 s 21 09 0304 0001 0033 51 = 0401010a 00000000 00000000 00000000 00000000 0000ff00 00000000 00000000
ffff8a9b1e2ab800 3836368309 C Co:5:002:0 0 51 >
ffff8a9b1e2ab800 3836468524 S Co:5:002:0 s 21 09 0304 0001 0033 51 = 0401010b 00000000 00000000 00000000 00000000 0000ff00 00000000 00000000
ffff8a9b1e2ab800 3836469522 C Co:5:002:0 0 51 >
ffff8a9b1e2ab800 3836569756 S Co:5:002:0 s 21 09 0304 0001 0033 51 = 0401010c 00000000 00000000 00000000 000000ff 8000ff00 00000000 00000000
ffff8a9b1e2ab800 3836570706 C Co:5:002:0 0 51 >
ffff8a9b1e2ab800 3836671009 S Co:5:002:0 s 21 09 0304 0001 0033 51 = 0401010d 00000000 00000000 00000000 000000ff ffffff00 00000000 00000000
ffff8a9b1e2ab800 3836671970 C Co:5:002:0 0 51 >
ffff8a9b1e2ab800 3836772270 S Co:5:002:0 s 21 09 0304 0001 0033 51 = 0401010e 00000000 00000000 00000000 00000000 ffffff00 00000000 00000000
ffff8a9b1e2ab800 3836773079 C Co:5:002:0 0 51 >
ffff8a9b1e2ab800 3836873465 S Co:5:002:0 s 21 09 0304 0001 0033 51 = 0401010f 00000000 00000000 00000000 000000ff 00ffff00 00000000 00000000
ffff8a9b1e2ab800 3836874294 C Co:5:002:0 0 51 >
ffff8a9b02b0f680 3837773153 S Bo:5:008:4 -115 36 = 00000006 00000024 feedface 10010ffd 00d9f27e 00000000 00000000 50020200
ffff8a9b02b0f680 3837773190 C Bo:5:008:4 0 36 >
ffff8a9b0442a540 3837773900 C Bi:5:008:5 0 36 = 00000006 00000024 faceface 08421001 f27e00d9 00000000 00000001 5f120200
ffff8a9b0442a540 3837773921 S Bo:5:008:4 -115 36 = 00000006 00000024 feedface 10021001 00d9f27e 00000001 00000001 50100200
ffff8a9b0442a540 3837773940 C Bo:5:008:4 0 36 >
ffff8a9b02b0f680 3837773945 S Bi:5:008:5 -115 16384 <
ffff8a9b0442a540 3837774186 S Bo:5:008:4 -115 319 = 00000006 0000013f feedface 10031001 00d9f27e 00000001 00000001 50100200
ffff8a9b0442a540 3837774224 C Bo:5:008:4 0 319 >
ffff8a9b0442be00 3837774589 C Bi:5:008:5 0 40 = 00000006 00000028 faceface 08431003 f27e00d9 00000001 0000011c 50100200
ffff8a9b0442be00 3837774595 S Bo:5:008:4 -115 36 = 00000006 00000024 feedface 10041003 00d9f27e 0000011c 00000001 50100200
ffff8a9b0442a540 3837774600 S Bi:5:008:5 -115 16384 <
ffff8a9b0442be00 3837774620 C Bo:5:008:4 0 36 >
ffff8a9b043c5d40 3837774671 C Bi:5:008:5 0 333 = 00000006 0000014d faceface 08441003 f27e00d9 00000005 0000011c 50100200
ffff8a9b043c5d40 3837774676 S Bo:5:008:4 -115 36 = 00000006 00000024 feedface 10051003 00d9f27e 0000011c 00000005 50100200
ffff8a9b0442be00 3837774680 S Bi:5:008:5 -115 16384 <
ffff8a9b043c5d40 3837774710 C Bo:5:008:4 0 36 >
ffff8a9b043c5d40 3837774740 S Bo:5:008:4 -115 367 = 00000006 0000016f feedface 10061003 00d9f27e 0000011c 0000012e 50100200
ffff8a9b043c5d40 3837774762 C Bo:5:008:4 0 367 >
ffff8a9b02b0f680 3837775121 C Bi:5:008:5 0 40 = 00000006 00000028 faceface 08451006 f27e00d9 0000012e 00000267 50100200
ffff8a9b02b0f680 3837775125 S Bo:5:008:4 -115 36 = 00000006 00000024 feedface 10071006 00d9f27e 00000267 0000012e 50100200
ffff8a9b043c5d40 3837775128 S Bi:5:008:5 -115 16384 <
ffff8a9b02b0f680 3837775159 C Bo:5:008:4 0 36 >
ffff8a9b0442a540 3837775199 C Bi:5:008:5 0 361 = 00000006 00000169 faceface 08461006 f27e00d9 00000132 00000267 50100200
ffff8a9b0442a540 3837775202 S Bo:5:008:4 -115 36 = 00000006 00000024 feedface 10081006 00d9f27e 00000267 00000132 50100200
ffff8a9b02b0f680 3837775205 S Bi:5:008:5 -115 16384 <
ffff8a9b0442a540 3837775239 C Bo:5:008:4 0 36 >
ffff8a9b0442a540 3837775248 S Bo:5:008:4 -115 364 = 00000006 0000016c feedface 10091006 00d9f27e 00000267 00000277 50100200
ffff8a9b0442a540 3837775277 C Bo:5:008:4 0 364 >
ffff8a9b0442be00 3837775541 C Bi:5:008:5 0 40 = 00000006 00000028 faceface 08471009 f27e00d9 00000277 000003af 50100200
ffff8a9b0442be00 3837775544 S Bo:5:008:4 -115 36 = 00000006 00000024 feedface 100a1009 00d9f27e 000003af 00000277 50100200
ffff8a9b0442a540 3837775547 S Bi:5:008:5 -115 16384 <
ffff8a9b0442be00 3837775579 C Bo:5:008:4 0 36 >
ffff8a9b043c5d40 3837775580 C Bi:5:008:5 0 360 = 00000006 00000168 faceface 08481009 f27e00d9 0000027b 000003af 50100200
ffff8a9b043c5d40 3837775583 S Bo:5:008:4 -115 36 = 00000006 00000024 feedface 100b1009 00d9f27e 000003af 0000027b 50100200
ffff8a9b0442be00 3837775586 S Bi:5:008:5 -115 16384 <
ffff8a9b043c5d40 3837775619 C Bo:5:008:4 0 36 >
ffff8a9b043c5d40 3837775749 S Bo:5:008:4 -115 368 = 00000006 00000170 feedface 100c1009 00d9f27e 000003af 000003bf 50100200
ffff8a9b043c5d40 3837775772 C Bo:5:008:4 0 368 >
ffff8a9b02b0f680 3837778317 C Bi:5:008:5 0 40 = 00000006 00000028 faceface 0849100c f27e00d9 000003bf 000004fb 50100200
ffff8a9b02b0f680 3837778320 S Bo:5:008:4 -115 36 = 00000006 00000024 feedface 100d100c 00d9f27e 000004fb 000003bf 50100200
ffff8a9b043c5d40 3837778340 S Bi:5:008:5 -115 16384 <
ffff8a9b02b0f680 3837778349 C Bo:5:008:4 0 36 >
ffff8a9b0442a540 3837778393 C Bi:5:008:5 0 950 = 00000006 000003b6 faceface 084a100c f27e00d9 000003c3 000004fb 50100200
ffff8a9b0442a540 3837778396 S Bo:5:008:4 -115 36 = 00000006 00000024 feedface 100e100c 00d9f27e 000004fb 000003c3 50100200
ffff8a9b02b0f680 3837778398 S Bi:5:008:5 -115 16384 <
ffff8a9b0442a540 3837778437 C Bo:5:008:4 0 36 >
ffff8a9b0442a540 3837799592 S Bo:5:008:4 -115 364 = 00000006 0000016c feedface 100f100c 00d9f27e 000004fb 00000755 50100200
ffff8a9b0442a540 3837799637 C Bo:5:008:4 0 364 >
ffff8a9b0442be00 3837800684 C Bi:5:008:5 0 40 = 00000006 00000028 faceface 084b100f f27e00d9 00000755 00000643 50100200
ffff8a9b043c5d40 3837800688 C Bi:5:008:5 0 371 = 00000006 00000173 faceface 084c100f f27e00d9 00000759 00000643 50100200
ffff8a9b0442be00 3837800698 S Bo:5:008:4 -115 36 = 00000006 00000024 feedface 1010100f 00d9f27e 00000643 00000755 50100200
ffff8a9b0442a540 3837800709 S Bi:5:008:5 -115 16384 <
ffff8a9b0442be00 3837800717 C Bo:5:008:4 0 36 >
ffff8a9b043c5d40 3837800718 S Bo:5:008:4 -115 36 = 00000006 00000024 feedface 1011100f 00d9f27e 00000643 00000755 50100200
ffff8a9b1e2ae540 3837800721 S Bi:5:008:5 -115 16384 <
ffff8a9b043c5d40 3837800757 C Bo:5:008:4 0 36 >
ffff8a9b043c5d40 3837800836 S Bo:5:008:4 -115 4886 = 00000006 00001316 feedface 1012100f 00d9f27e 00000643 000008a8 50100200
ffff8a9b043c5d40 3837800975 C Bo:5:008:4 0 4886 >
ffff8a9b02b0f680 3837807562 C Bi:5:008:5 0 40 = 00000006 00000028 faceface 084d1012 f27e00d9 000008a8 00001935 50100200
ffff8a9b0442a540 3837807571 C Bi:5:008:5 0 321 = 00000006 00000141 faceface 084e1012 f27e00d9 000008ac 00001935 50100200
ffff8a9b02b0f680 3837807600 S Bo:5:008:4 -115 36 = 00000006 00000024 feedface 10131012 00d9f27e 00001935 000008a8 50100200
ffff8a9b043c5d40 3837807616 S Bi:5:008:5 -115 16384 <
ffff8a9b02b0f680 3837807626 C Bo:5:008:4 0 36 >
ffff8a9b0442a540 3837807630 S Bo:5:008:4 -115 36 = 00000006 00000024 feedface 10141012 00d9f27e 00001935 000008a8 50100200
ffff8a9b0442be00 3837807634 S Bi:5:008:5 -115 16384 <
ffff8a9b0442a540 3837807669 C Bo:5:008:4 0 36 >
ffff8a9b0442a540 3837807834 S Bo:5:008:4 -115 36 = 00000006 00000024 feedface 10151012 00d9f27e 00001935 000009c9 50040200
ffff8a9b0442a540 3837807853 C Bo:5:008:4 0 36 >
ffff8a9b0442a540 3842813613 S Bo:5:008:4 -115 36 = 00000006 00000024 feedface 10161012 00daf27e 00000000 00000000 50020200
ffff8a9b0442a540 3842813662 C Bo:5:008:4 0 36 >
ffff8a9b1e2ae540 3842814758 C Bi:5:008:5 0 36 = 00000006 00000024 faceface 084f1016 f27e00da 00000000 00000001 55120200
ffff8a9b1e2ae540 3842814795 S Bo:5:008:4 -115 36 = 00000006 00000024 feedface 10171016 00daf27e 00000001 00000001 50100200
ffff8a9b0442a540 3842814807 S Bi:5:008:5 -115 16384 <
ffff8a9b1e2ae540 3842814814 C Bo:5:008:4 0 36 >
ffff8a9b1e2ae540 3842814909 S Bo:5:008:4 -115 319 = 00000006 0000013f feedface 10181016 00daf27e 00000001 00000001 50100200
ffff8a9b1e2ae540 3842814932 C Bo:5:008:4 0 319 >
ffff8a9b043c5d40 3842816075 C Bi:5:008:5 0 337 = 00000006 00000151 faceface 08501018 f27e00da 00000001 0000011c 50100200
ffff8a9b043c5d40 3842816104 S Bo:5:008:4 -115 36 = 00000006 00000024 feedface 10191018 00daf27e 0000011c 00000001 50100200
ffff8a9b1e2ae540 3842816119 S Bi:5:008:5 -115 16384 <
ffff8a9b043c5d40 3842816127 C Bo:5:008:4 0 36 >
ffff8a9b043c5d40 3842816368 S Bo:5:008:4 -115 367 = 00000006 0000016f feedface 101a1018 00daf27e 0000011c 0000012e 50100200
ffff8a9b043c5d40 3842816441 C Bo:5:008:4 0 367 >
ffff8a9b0442be00 3842817470 C Bi:5:008:5 0 365 = 00000006 0000016d faceface 0851101a f27e00da 0000012e 00000267 50100200
ffff8a9b0442be00 3842817476 S Bo:5:008:4 -115 36 = 00000006 00000024 feedface 101b101a 00daf27e 00000267 0000012e 50100200
ffff8a9b043c5d40 3842817481 S Bi:5:008:5 -115 16384 <
ffff8a9b0442be00 3842817498 C Bo:5:008:4 0 36 >
ffff8a9b0442be00 3842817615 S Bo:5:008:4 -115 364 = 00000006 0000016c feedface 101c101a 00daf27e 00000267 00000277 50100200
ffff8a9b0442be00 3842817638 C Bo:5:008:4 0 364 >
ffff8a9b0442a540 3842818506 C Bi:5:008:5 0 364 = 00000006 0000016c faceface 0852101c f27e00da 00000277 000003af 50100200
ffff8a9b0442a540 3842818510 S Bo:5:008:4 -115 36 = 00000006 00000024 feedface 101d101c 00daf27e 000003af 00000277 50100200
ffff8a9b0442be00 3842818512 S Bi:5:008:5 -115 16384 <
ffff8a9b0442a540 3842818547 C Bo:5:008:4 0 36 >
ffff8a9b0442a540 3842818716 S Bo:5:008:4 -115 368 = 00000006 00000170 feedface 101e101c 00daf27e 000003af 000003bf 50100200
ffff8a9b0442a540 3842818754 C Bo:5:008:4 0 368 >
ffff8a9b1e2ae540 3842828505 C Bi:5:008:5 0 954 = 00000006 000003ba faceface 0853101e f27e00da 000003bf 000004fb 50100200
ffff8a9b1e2ae540 3842828518 S Bo:5:008:4 -115 36 = 00000006 00000024 feedface 101f101e 00daf27e 000004fb 000003bf 50100200
ffff8a9b0442a540 3842828528 S Bi:5:008:5 -115 16384 <
ffff8a9b1e2ae540 3842828536 C Bo:5:008:4 0 36 >
ffff8a9b1e2ae540 3842859004 S Bo:5:008:4 -115 36 = 00000006 00000024 feedface 1020101e 00daf27e 000004fb 00000755 50100200
ffff8a9b1e2ae540 3842859032 C Bo:5:008:4 0 36 >
ffff8a9b1e2ae540 3842894370 S Bo:5:008:4 -115 364 = 00000006 0000016c feedface 1021101e 00daf27e 000004fb 00000755 50100200
ffff8a9b1e2ae540 3842894540 C Bo:5:008:4 0 364 >
ffff8a9b043c5d40 3842895462 C Bi:5:008:5 0 375 = 00000006 00000177 faceface 08541021 f27e00da 00000755 00000643 50100200
ffff8a9b043c5d40 3842895475 S Bo:5:008:4 -115 36 = 00000006 00000024 feedface 10221021 00daf27e 00000643 00000755 50100200
ffff8a9b1e2ae540 3842895487 S Bi:5:008:5 -115 16384 <
ffff8a9b043c5d40 3842895496 C Bo:5:008:4 0 36 >
ffff8a9b043c5d40 3842895698 S Bo:5:008:4 -115 4886 = 00000006 00001316 feedface 10231021 00daf27e 00000643 000008a8 50100200
ffff8a9b043c5d40 3842895839 C Bo:5:008:4 0 4886 >
ffff8a9b0442be00 3842909124 C Bi:5:008:5 0 325 = 00000006 00000145 faceface 08551023 f27e00da 000008a8 00001935 50100200
ffff8a9b0442be00 3842909156 S Bo:5:008:4 -115 36 = 00000006 00000024 feedface 10241023 00daf27e 00001935 000008a8 50100200
ffff8a9b043c5d40 3842909171 S Bi:5:008:5 -115 16384 <
ffff8a9b0442be00 3842909180 C Bo:5:008:4 0 36 >
ffff8a9b0442be00 3842909478 S Bo:5:008:4 -115 36 = 00000006 00000024 feedface 10251023 00daf27e 00001935 000009c9 50040200
ffff8a9b0442be00 3842909501 C Bo:5:008:4 0 36 >
ffff8a9b0442be00 3847915123 S Bo:5:008:4 -115 36 = 00000006 00000024 feedface 10261023 00dbf27e 00000000 00000000 50020200
ffff8a9b0442be00 3847915164 C Bo:5:008:4 0 36 >
ffff8a9b0442a540 3847916141 C Bi:5:008:5 0 36 = 00000006 00000024 faceface 08561026 f27e00db 00000000 00000001 5f120200
ffff8a9b0442a540 3847916174 S Bo:5:008:4 -115 36 = 00000006 00000024 feedface 10271026 00dbf27e 00000001 00000001 50100200
ffff8a9b0442a540 3847916197 C Bo:5:008:4 0 36 >
ffff8a9b0442be00 3847916207 S Bi:5:008:5 -115 16384 <
ffff8a9b0442a540 3847916387 S Bo:5:008:4 -115 319 = 00000006 0000013f feedface 10281026 00dbf27e 00000001 00000001 50100200
ffff8a9b0442a540 3847916412 C Bo:5:008:4 0 319 >
ffff8a9b1e2ae540 3847917297 C Bi:5:008:5 0 337 = 00000006 00000151 faceface 08571028 f27e00db 00000001 0000011c 50100200
ffff8a9b1e2ae540 3847917302 S Bo:5:008:4 -115 36 = 00000006 00000024 feedface 10291028 00dbf27e 0000011c 00000001 50100200
ffff8a9b0442a540 3847917305 S Bi:5:008:5 -115 16384 <
ffff8a9b1e2ae540 3847917335 C Bo:5:008:4 0 36 >
ffff8a9b1e2ae540 3847917475 S Bo:5:008:4 -115 367 = 00000006 0000016f feedface 102a1028 00dbf27e 0000011c 0000012e 50100200
ffff8a9b1e2ae540 3847917498 C Bo:5:008:4 0 367 >
ffff8a9b043c5d40 3847918701 C Bi:5:008:5 0 365 = 00000006 0000016d faceface 0858102a f27e00db 0000012e 00000267 50100200
ffff8a9b043c5d40 3847918714 S Bo:5:008:4 -115 36 = 00000006 00000024 feedface 102b102a 00dbf27e 00000267 0000012e 50100200
ffff8a9b1e2ae540 3847918725 S Bi:5:008:5 -115 16384 <
ffff8a9b043c5d40 3847918739 C Bo:5:008:4 0 36 >
ffff8a9b043c5d40 3847918844 S Bo:5:008:4 -115 364 = 00000006 0000016c feedface 102c102a 00dbf27e 00000267 00000277 50100200
ffff8a9b043c5d40 3847918882 C Bo:5:008:4 0 364 >
ffff8a9b0442be00 3847919835 C Bi:5:008:5 0 40 = 00000006 00000028 faceface 0859102c f27e00db 00000277 000003af 50100200
ffff8a9b0442a540 3847919838 C Bi:5:008:5 0 360 = 00000006 00000168 faceface 085a102c f27e00db 0000027b 000003af 50100200
ffff8a9b0442be00 3847919848 S Bo:5:008:4 -115 36 = 00000006 00000024 feedface 102d102c 00dbf27e 000003af 00000277 50100200
ffff8a9b043c5d40 3847919859 S Bi:5:008:5 -115 16384 <
ffff8a9b0442be00 3847919866 C Bo:5:008:4 0 36 >
ffff8a9b0442a540 3847919867 S Bo:5:008:4 -115 36 = 00000006 00000024 feedface 102e102c 00dbf27e 000003af 00000277 50100200
ffff8a9b02b0f680 3847919870 S Bi:5:008:5 -115 16384 <
ffff8a9b0442a540 3847919909 C Bo:5:008:4 0 36 >
ffff8a9b0442a540 3847920120 S Bo:5:008:4 -115 368 = 00000006 00000170 feedface 102f102c 00dbf27e 000003af 000003bf 50100200
ffff8a9b0442a540 3847920144 C Bo:5:008:4 0 368 >
ffff8a9b1e2ae540 3847930179 C Bi:5:008:5 0 954 = 00000006 000003ba faceface 085b102f f27e00db 000003bf 000004fb 50100200
ffff8a9b1e2ae540 3847930208 S Bo:5:008:4 -115 36 = 00000006 00000024 feedface 1030102f 00dbf27e 000004fb 000003bf 50100200
ffff8a9b0442a540 3847930223 S Bi:5:008:5 -115 16384 <
ffff8a9b1e2ae540 3847930231 C Bo:5:008:4 0 36 >
ffff8a9b1e2ae540 3847961005 S Bo:5:008:4 -115 36 = 00000006 00000024 feedface 1031102f 00dbf27e 000004fb 00000755 50100200
ffff8a9b1e2ae540 3847961033 C Bo:5:008:4 0 36 >
ffff8a9b1e2ae540 3847969756 S Bo:5:008:4 -115 364 = 00000006 0000016c feedface 1032102f 00dbf27e 000004fb 00000755 50100200
ffff8a9b1e2ae540 3847969785 C Bo:5:008:4 0 364 >
ffff8a9b043c5d40 3847970966 C Bi:5:008:5 0 375 = 00000006 00000177 faceface 085c1032 f27e00db 00000755 00000643 50100200
ffff8a9b043c5d40 3847971009 S Bo:5:008:4 -115 36 = 00000006 00000024 feedface 10331032 00dbf27e 00000643 00000755 50100200
ffff8a9b1e2ae540 3847971022 S Bi:5:008:5 -115 16384 <
ffff8a9b043c5d40 3847971031 C Bo:5:008:4 0 36 >
ffff8a9b043c5d40 3847971173 S Bo:5:008:4 -115 4886 = 00000006 00001316 feedface 10341032 00dbf27e 00000643 000008a8 50100200
ffff8a9b043c5d40 3847971308 C Bo:5:008:4 0 4886 >
ffff8a9b02b0f680 3847984917 C Bi:5:008:5 0 40 = 00000006 00000028 faceface 085d1034 f27e00db 000008a8 00001935 50100200
ffff8a9b0442a540 3847984926 C Bi:5:008:5 0 321 = 00000006 00000141 faceface 085e1034 f27e00db 000008ac 00001935 50100200
ffff8a9b02b0f680 3847984963 S Bo:5:008:4 -115 36 = 00000006 00000024 feedface 10351034 00dbf27e 00001935 000008a8 50100200
ffff8a9b043c5d40 3847984978 S Bi:5:008:5 -115 16384 <
ffff8a9b0442a540 3847984984 S Bo:5:008:4 -115 36 = 00000006 00000024 feedface 10361034 00dbf27e 00001935 000008a8 50100200
ffff8a9b02b0f680 3847984994 C Bo:5:008:4 0 36 >
ffff8a9b0442be00 3847984996 S Bi:5:008:5 -115 16384 <
ffff8a9b0442a540 3847985056 C Bo:5:008:4 0 36 >
ffff8a9b0442a540 3847985297 S Bo:5:008:4 -115 36 = 00000006 00000024 feedface 10371034 00dbf27e 00001935 000009c9 50040200
ffff8a9b0442a540 3847985319 C Bo:5:008:4 0 36 >
ffff8a9b1e2ab800 3851974899 S Co:5:002:0 s 21 0a 0000 0000 0000 0
ffff8a9b1e2ab800 3851975236 C Co:5:002:0 0 0
ffff8a9b1e2ab800 3851975389 S Ci:5:002:0 s 81 06 2200 0000 01a3 419 <
ffff8a9b1e2ab800 3851978228 C Ci:5:002:0 0 419 = 0689ff09 10a10185 a5090115 0026ff00 75089510 b100c005 010906a1 01850175
ffff8a9b02b0efc0 3851978892 S Co:5:002:0 s 21 09 0201 0000 0002 2 = 0100
ffff8a9b16dfc780 3851979315 S Co:5:002:0 s 21 09 035a 0000 0004 4 = 5ad04e01
ffff8a9b02b0efc0 3851979550 C Co:5:002:0 0 2 >
ffff8a9b16dfc780 3851980302 C Co:5:002:0 0 4 >
ffff8a9b1e2ab800 3851980435 S Ii:5:002:1 -115:4 61 <
ffff8a9b1e2ab800 3851981238 C Ii:5:002:1 0:4 6 = 5decb300 0000
ffff8a9b1e2ab800 3851981241 S Ii:5:002:1 -115:4 61 <
ffff8a9b1e2ab800 3851985240 C Ii:5:002:1 0:4 6 = 5decb400 0000
ffff8a9b1e2ab800 3851985244 S Ii:5:002:1 -115:4 61 <
ffff8a9b1e2ab800 3851989265 C Ii:5:002:1 0:4 6 = 5decb500 0000
ffff8a9b1e2ab800 3851989269 S Ii:5:002:1 -115:4 61 <
ffff8a9b31a3e600 3852055458 S Co:5:002:0 s 21 09 035a 0000 0010 16 = 5a415355 53205465 63682e49 6e632e00
ffff8a9b31a3e600 3852056342 C Co:5:002:0 0 16 >
ffff8a9b31a3e600 3852056361 S Ci:5:002:0 s a1 01 035a 0000 0040 64 <
ffff8a9b1e2ab800 3852057129 C Ii:5:002:1 0:4 6 = 5aec0200 0000
ffff8a9b1e2ab800 3852057136 S Ii:5:002:1 -115:4 61 <
ffff8a9b31a3e600 3852057169 C Ci:5:002:0 0 63 = 5a415355 53205465 63682e49 6e632e00 08951081 02098e15 0026ff00 75089510
ffff8a9b31a3e600 3852057291 S Co:5:002:0 s 21 09 035a 0000 0006 6 = 5a052031 0008
ffff8a9b31a3e600 3852058126 C Co:5:002:0 0 6 >
ffff8a9b31a3e600 3852058221 S Ci:5:002:0 s a1 01 035a 0000 0040 64 <
ffff8a9b31a3e600 3852059079 C Ci:5:002:0 0 63 = 5a052031 00080301 01022505 01020000 00000000 00000000 00000000 00089510
ffff8a9b31a3e600 3852059225 S Co:5:002:0 s 21 09 035d 0000 0010 16 = 5d415355 53205465 63682e49 6e632e00
ffff8a9b31a3e600 3852060182 C Co:5:002:0 0 16 >
ffff8a9b31a3e600 3852060290 S Ci:5:002:0 s a1 01 035d 0000 0040 64 <
ffff8a9b31a3e600 3852061161 C Ci:5:002:0 0 63 = 5d415355 53205465 63682e49 6e632e00 00000000 00000000 00000000 00089510
ffff8a9b31a3e600 3852061331 S Co:5:002:0 s 21 09 035e 0000 0010 16 = 5e415355 53205465 63682e49 6e632e00
ffff8a9b31a3e600 3852062034 C Co:5:002:0 0 16 >
ffff8a9b31a3e600 3852062131 S Ci:5:002:0 s a1 01 035e 0000 0040 64 <
ffff8a9b31a3e600 3852062996 C Ci:5:002:0 0 16 = 5effffff ffffffff ffffffff ffffffff
ffff8a9b31a3e600 3852063234 S Co:5:002:0 s 21 0a 0000 0001 0000 0
ffff8a9b043c2b40 3852063258 S Co:5:002:0 s 21 09 035a 0000 0005 5 = 5abac5c4 03
ffff8a9b31a3e600 3852063510 C Co:5:002:0 -32 0
ffff8a9b31a3e600 3852063610 S Ci:5:002:0 s 81 06 2200 0001 0147 327 <
ffff8a9b043c2b40 3852064124 C Co:5:002:0 0 5 >
ffff8a9b31a3e600 3852066599 C Ci:5:002:0 0 327 = 05590901 a1018501 0902a102 09031500 27ffff00 00751095 01b10309 04090509
ffff8a9b02b0efc0 3852873883 S Co:5:002:0 s 21 09 0201 0000 0002 2 = 0101
ffff8a9b02b0efc0 3852874660 C Co:5:002:0 0 2 >
ffff8a9b043c3140 3852985957 S Bo:5:008:4 -115 36 = 00000006 00000024 feedface 10381034 00dcf27e 00000000 00000000 50020200
ffff8a9b043c3140 3852986064 C Bo:5:008:4 0 36 >
ffff8a9b1e2ae540 3852987063 C Bi:5:008:5 0 36 = 00000006 00000024 faceface 085f1038 f27e00dc 00000000 00000001 5d120200
ffff8a9b1e2ae540 3852987164 S Bo:5:008:4 -115 36 = 00000006 00000024 feedface 10391038 00dcf27e 00000001 00000001 50100200
ffff8a9b043c3140 3852987180 S Bi:5:008:5 -115 16384 <
ffff8a9b11546f00 3852987247 S Bo:5:008:4 -115 319 = 00000006 0000013f feedface 103a1038 00dcf27e 00000001 00000001 50100200
ffff8a9b1e2ae540 3852987264 C Bo:5:008:4 0 36 >
ffff8a9b11546f00 3852987273 C Bo:5:008:4 0 319 >
ffff8a9b043c5d40 3852988123 C Bi:5:008:5 0 40 = 00000006 00000028 faceface 0860103a f27e00dc 00000001 0000011c 50100200
ffff8a9b0442be00 3852988166 C Bi:5:008:5 0 333 = 00000006 0000014d faceface 0861103a f27e00dc 00000005 0000011c 50100200
ffff8a9b043c5d40 3852988261 S Bo:5:008:4 -115 36 = 00000006 00000024 feedface 103b103a 00dcf27e 0000011c 00000001 50100200
ffff8a9b11546f00 3852988274 S Bi:5:008:5 -115 16384 <
ffff8a9b0442be00 3852988279 S Bo:5:008:4 -115 36 = 00000006 00000024 feedface 103c103a 00dcf27e 0000011c 00000001 50100200
ffff8a9b043c5d40 3852988282 C Bo:5:008:4 0 36 >
ffff8a9b1e2ae540 3852988285 S Bi:5:008:5 -115 16384 <
ffff8a9b0442be00 3852988324 C Bo:5:008:4 0 36 >
ffff8a9b0442be00 3852988353 S Bo:5:008:4 -115 367 = 00000006 0000016f feedface 103d103a 00dcf27e 0000011c 0000012e 50100200
ffff8a9b0442be00 3852988497 C Bo:5:008:4 0 367 >
ffff8a9b043c3140 3852989455 C Bi:5:008:5 0 40 = 00000006 00000028 faceface 0862103d f27e00dc 0000012e 00000267 50100200
ffff8a9b11546f00 3852989541 C Bi:5:008:5 0 361 = 00000006 00000169 faceface 0863103d f27e00dc 00000132 00000267 50100200
ffff8a9b043c3140 3852989559 S Bo:5:008:4 -115 36 = 00000006 00000024 feedface 103e103d 00dcf27e 00000267 0000012e 50100200
ffff8a9b0442be00 3852989571 S Bi:5:008:5 -115 16384 <
ffff8a9b11546f00 3852989576 S Bo:5:008:4 -115 36 = 00000006 00000024 feedface 103f103d 00dcf27e 00000267 0000012e 50100200
ffff8a9b043c3140 3852989579 C Bo:5:008:4 0 36 >
ffff8a9b043c5d40 3852989581 S Bi:5:008:5 -115 16384 <
ffff8a9b11546f00 3852989622 C Bo:5:008:4 0 36 >
ffff8a9b11546f00 3852989691 S Bo:5:008:4 -115 364 = 00000006 0000016c feedface 1040103d 00dcf27e 00000267 00000277 50100200
ffff8a9b11546f00 3852989773 C Bo:5:008:4 0 364 >
ffff8a9b1e2ae540 3852990536 C Bi:5:008:5 0 40 = 00000006 00000028 faceface 08641040 f27e00dc 00000277 000003af 50100200
ffff8a9b1e2ae540 3852990627 S Bo:5:008:4 -115 36 = 00000006 00000024 feedface 10411040 00dcf27e 000003af 00000277 50100200
ffff8a9b11546f00 3852990643 S Bi:5:008:5 -115 16384 <
ffff8a9b0442be00 3852990646 C Bi:5:008:5 0 360 = 00000006 00000168 faceface 08651040 f27e00dc 0000027b 000003af 50100200
ffff8a9b0442be00 3852990648 S Bo:5:008:4 -115 36 = 00000006 00000024 feedface 10421040 00dcf27e 000003af 00000277 50100200
ffff8a9b043c3140 3852990651 S Bi:5:008:5 -115 16384 <
ffff8a9b1e2ae540 3852990681 C Bo:5:008:4 0 36 >
ffff8a9b0442be00 3852990683 C Bo:5:008:4 0 36 >
ffff8a9b0442be00 3852990799 S Bo:5:008:4 -115 368 = 00000006 00000170 feedface 10431040 00dcf27e 000003af 000003bf 50100200
ffff8a9b0442be00 3852990822 C Bo:5:008:4 0 368 >
ffff8a9b043c5d40 3853001290 C Bi:5:008:5 0 954 = 00000006 000003ba faceface 08661043 f27e00dc 000003bf 000004fb 50100200
ffff8a9b043c5d40 3853001457 S Bo:5:008:4 -115 36 = 00000006 00000024 feedface 10441043 00dcf27e 000004fb 000003bf 50100200
ffff8a9b0442be00 3853001469 S Bi:5:008:5 -115 16384 <
ffff8a9b043c5d40 3853001582 C Bo:5:008:4 0 36 >
ffff8a9b043c5d40 3853032005 S Bo:5:008:4 -115 36 = 00000006 00000024 feedface 10451043 00dcf27e 000004fb 00000755 50100200
ffff8a9b043c5d40 3853032141 C Bo:5:008:4 0 36 >
ffff8a9b0442a540 3853090638 S Bo:5:008:4 -115 364 = 00000006 0000016c feedface 10461043 00dcf27e 000004fb 00000755 50100200
ffff8a9b0442a540 3853090670 C Bo:5:008:4 0 364 >
ffff8a9b11546f00 3853092168 C Bi:5:008:5 0 375 = 00000006 00000177 faceface 08671046 f27e00dc 00000755 00000643 50100200
ffff8a9b11546f00 3853092199 S Bo:5:008:4 -115 36 = 00000006 00000024 feedface 10471046 00dcf27e 00000643 00000755 50100200
ffff8a9b0442a540 3853092214 S Bi:5:008:5 -115 16384 <
ffff8a9b11546f00 3853092224 C Bo:5:008:4 0 36 >
ffff8a9b11546f00 3853092373 S Bo:5:008:4 -115 40 = 00000006 00000028 feedface 10481046 00dcf27e 00000643 000008a8 50100200
ffff8a9b11546f00 3853092392 C Bo:5:008:4 0 40 >
ffff8a9b02b0f680 3853092395 S Bo:5:008:4 -115 4882 = 00000006 00001312 feedface 10491046 00dcf27e 00000647 000008a8 50100200
ffff8a9b02b0f680 3853092587 C Bo:5:008:4 0 4882 >
ffff8a9b043c3140 3853110335 C Bi:5:008:5 0 325 = 00000006 00000145 faceface 08681049 f27e00dc 000008a8 00001935 50100200
ffff8a9b043c3140 3853110366 S Bo:5:008:4 -115 36 = 00000006 00000024 feedface 104a1049 00dcf27e 00001935 000008a8 50100200
ffff8a9b02b0f680 3853110381 S Bi:5:008:5 -115 16384 <
ffff8a9b043c3140 3853110389 C Bo:5:008:4 0 36 >
ffff8a9b043c3140 3853110712 S Bo:5:008:4 -115 36 = 00000006 00000024 feedface 104b1049 00dcf27e 00001935 000009c9 50040200
ffff8a9b043c3140 3853110738 C Bo:5:008:4 0 36 >
